{"account_hint":null,"action_type":"read","authorization":{"already_given":[],"still_required":[]},"conversation_reference":{"access":"owner-shared","note":"Example package — written for documentation, not a live request.","platform":"chatgpt","reference":"GPT conversation in which Zachary asked for the opt-out terms to be re-checked (reference carried as data; it grants no access)"},"files_needed":[],"kind":"browser_request","known_choices":[{"name":"document_section","source":"Zachary pasted these terms to Muse on 2026-10-07","value":"Section 19 (arbitration opt-out)"},{"name":"report_verbatim","source":"browser-connector hard rule","value":"true — quote the operative opt-out sentence exactly, do not paraphrase the destination"}],"objective":"Read Meta Muse's published Supplemental Terms and report, verbatim, what opt-out method Section 19 specifies: postal address or email, the exact destination, and the deadline window. Read-only; do not submit anything.","permissions":{"credentials_in_packages":false,"irreversibles_require_user_word":true,"notes":"Pure read of a public page. No sign-in, no payment, no send."},"project_id":"heavenzfire-unified-field","request_id":"br-20261022-check-meta-muse-optout-terms","schema_version":"1.0.0","source_platform":"chatgpt","stop_conditions":["If Muse.ai/terms does not resolve to Meta Platforms, Inc.'s Muse terms, stop and report the mismatch instead of reading further.","If the page requires sign-in to read the terms, stop and report that — do not sign in for a read-only check."],"success_criteria":"Result package quotes the opt-out sentence verbatim from the terms page, names the specified method and destination, and gives the terms page URL as evidence with basis page_text_fetch.","target":{"legal_entity":"Meta Platforms, Inc.","site":"https://Muse.ai/terms","terms_location":"https://Muse.ai/terms"},"timestamp":"2026-10-22T17:52:00-05:00"}